{
  "$schema":"https://json-schema.org/draft/2020-12/schema",
  "$id":"https://github.com/jeongiryang/kg-ontology-decision-framework-reboot/contracts/academic-intent-profile.schema.json",
  "title":"AcademicIntentProfile",
  "type":"object",
  "additionalProperties":false,
  "required":["schema_version","protected_aliases","broad_graduation_aliases","exception_aliases","individual_determination_aliases","negation_aliases","disjunction_aliases","conjunction_aliases","comparison_aliases","contextual_aliases","intents"],
  "properties":{
    "schema_version":{"const":"1.0.0"},
    "protected_aliases":{"$ref":"#/$defs/aliases"},
    "broad_graduation_aliases":{"$ref":"#/$defs/aliases"},
    "exception_aliases":{"$ref":"#/$defs/aliases"},
    "individual_determination_aliases":{"$ref":"#/$defs/aliases"},
    "negation_aliases":{"$ref":"#/$defs/aliases"},
    "disjunction_aliases":{"$ref":"#/$defs/aliases"},
    "conjunction_aliases":{"$ref":"#/$defs/aliases"},
    "comparison_aliases":{"$ref":"#/$defs/aliases"},
    "contextual_aliases":{"type":"object","minProperties":1,"additionalProperties":{"$ref":"#/$defs/aliases"},"propertyNames":{"type":"string","minLength":1,"pattern":"^\\S+$"}},
    "intents":{"type":"array","minItems":31,"maxItems":31,"items":{"$ref":"#/$defs/intent"}}
  },
  "$defs":{
    "aliases":{"type":"array","minItems":1,"uniqueItems":true,"items":{"type":"string","minLength":1,"pattern":"^\\S+$"}},
    "intent":{
      "type":"object",
      "additionalProperties":false,
      "required":["intent_id","kind","aliases","rule_ids"],
      "properties":{
        "intent_id":{"type":"string","pattern":"^[a-z][a-z0-9]*(?:[._-][a-z0-9]+)+$"},
        "kind":{"enum":["specific","bundle"]},
        "aliases":{"$ref":"#/$defs/aliases"},
        "rule_ids":{"type":"array","minItems":1,"uniqueItems":true,"items":{"type":"string","pattern":"^[a-z0-9][a-z0-9._-]{2,127}$"}}
      }
    }
  }
}
