{
  "schema_version": "1.0.0",
  "protected_aliases": ["pccp", "캡스톤", "캡디", "졸업작품", "졸작", "공모전", "총장상", "대회수상", "외부대회", "코테", "코딩테스트", "코딩시험", "코딩평가", "topcit", "탑싯", "봉림소프트웨어"],
  "broad_graduation_aliases": ["졸업요건", "졸업조건", "졸업기준", "졸업가능", "졸업인증", "졸업할수", "졸업되", "졸업하나요", "졸업할까요", "졸업해요", "졸업해도", "졸업합니까", "졸업됩니까", "졸업돼요"],
  "exception_aliases": ["복학", "복학생", "재입학", "재입학생", "편입", "편입생", "경과조치", "경과조치대상"],
  "individual_determination_aliases": ["제경우", "내경우", "제학점", "내학점", "제과목", "내과목", "제가면제", "저도면제", "개인판정", "개인결과", "소급결과", "소급적용결과"],
  "negation_aliases": ["아닌", "아니고", "말고", "제외", "빼고"],
  "disjunction_aliases": ["또는", "혹은", "아니면", "중하나"],
  "conjunction_aliases": ["및", "그리고", "와", "과"],
  "comparison_aliases": ["vs", "대비", "비교"],
  "contextual_aliases": {"전선":["학점", "전공", "이수"]},
  "intents": [
    {"intent_id":"cohort.department-transfer.original-admission-year","kind":"specific","aliases":["전과","전과생","전과하면","전과입학연도","전과교육과정연도","전과적용입학연도"],"rule_ids":["cwnu.cs.2026.cohort.department-transfer-original-admission-year"]},
    {"intent_id":"course-counting.identical-course","kind":"specific","aliases":["동일교과목","동일교과목중복","동일과목","동일과목중복계산"],"rule_ids":["cwnu.cs.2026.course-counting.identical-course"]},
    {"intent_id":"course-counting.post-completion-equivalence","kind":"specific","aliases":["이수후대체지정","이수후대체지정된","이수후동일지정","이수후동일지정된","이수후동일대체지정","이수후동일대체지정된","이수후대체교과목","이수후동일교과목","동일대체과목계산"],"rule_ids":["cwnu.cs.2026.course-counting.post-completion-equivalence"]},
    {"intent_id":"course-counting.retake","kind":"specific","aliases":["재수강","재수강하면","재수강중복계산","재수강학점중복","재수강기이수삭제"],"rule_ids":["cwnu.cs.2026.course-counting.retake"]},
    {"intent_id":"credits.general.balanced","kind":"specific","aliases":["균형교양"],"rule_ids":["cwnu.cs.2026.credits.general-balanced"]},
    {"intent_id":"credits.general.foundation","kind":"specific","aliases":["기초교양"],"rule_ids":["cwnu.cs.2026.credits.general-foundation"]},
    {"intent_id":"credits.general.recognition-cap","kind":"specific","aliases":["교양인정상한","교양42학점인정","교양최대인정"],"rule_ids":["cwnu.cs.2026.credits.general-recognition-cap"]},
    {"intent_id":"credits.general.remaining-allocation","kind":"specific","aliases":["교양잔여충족","교양잔여배분"],"rule_ids":["cwnu.cs.2026.credits.general-remaining-allocation"]},
    {"intent_id":"credits.general.remaining","kind":"specific","aliases":["교양잔여학점","교양잔여"],"rule_ids":["cwnu.cs.2026.credits.general-remaining"]},
    {"intent_id":"credits.general.total","kind":"specific","aliases":["교양소계","교양총학점","교양최소이수학점","교양최소학점","최소교양학점","교양전체학점","교양총이수학점"],"rule_ids":["cwnu.cs.2026.credits.general-total"]},
    {"intent_id":"credits.graduation.remaining-allocation","kind":"specific","aliases":["졸업잔여충족","졸업잔여배분","자유선택충족"],"rule_ids":["cwnu.cs.2026.credits.graduation-remaining-allocation"]},
    {"intent_id":"credits.graduation.remaining","kind":"specific","aliases":["졸업잔여학점","졸업잔여"],"rule_ids":["cwnu.cs.2026.credits.graduation-remaining"]},
    {"intent_id":"credits.graduation.total","kind":"specific","aliases":["졸업학점","총이수학점","졸업최소학점","졸업총학점","졸업에필요한학점","졸업에필요한총학점"],"rule_ids":["cwnu.cs.2026.credits.graduation-total"]},
    {"intent_id":"credits.major.advanced","kind":"specific","aliases":["심화전공"],"rule_ids":["cwnu.cs.2026.credits.major-advanced"]},
    {"intent_id":"credits.major.elective","kind":"specific","aliases":["전공선택","전선"],"rule_ids":["cwnu.cs.2026.credits.major-elective"]},
    {"intent_id":"credits.major.minimum","kind":"specific","aliases":["최소전공"],"rule_ids":["cwnu.cs.2026.credits.major-minimum"]},
    {"intent_id":"credits.major.required","kind":"specific","aliases":["전공필수","전필"],"rule_ids":["cwnu.cs.2026.credits.major-required"]},
    {"intent_id":"credits.major.total","kind":"specific","aliases":["전공소계","전공총학점","전공최소이수학점","전공전체학점","전공총이수학점"],"rule_ids":["cwnu.cs.2026.credits.major-total"]},
    {"intent_id":"general.balanced-area-coverage","kind":"specific","aliases":["균형교양4개영역","균형교양영역이수","균형교양영역중복"],"rule_ids":["cwnu.cs.2026.general-balanced-area-coverage"]},
    {"intent_id":"general.recommended-courses","kind":"specific","aliases":["권장교양과목","컴퓨터개론권장","컴퓨터프로그래밍권장","공업수학권장"],"rule_ids":["cwnu.cs.2026.general-recommended-courses"]},
    {"intent_id":"graduation.thesis.completion-result","kind":"specific","aliases":["졸업논문0학점","졸업논문이0학점","졸업논문이0학점인데","졸업논문은0학점인데","졸업논문미이수","졸업논문fail","졸업논문이수결과"],"rule_ids":["cwnu.cs.2026.graduation.thesis-completion-result"]},
    {"intent_id":"graduation.thesis.linked-program-exemption","kind":"specific","aliases":["학석사연계과정","학석사연계과정생","연계과정논문면제"],"rule_ids":["cwnu.cs.2026.graduation.thesis-linked-program-exemption"]},
    {"intent_id":"graduation.thesis.required","kind":"specific","aliases":["졸업논문","논문요건","졸논"],"rule_ids":["cwnu.cs.2026.graduation.thesis-required"]},
    {"intent_id":"graduation.thesis.substitution","kind":"specific","aliases":["졸업논문대체","논문대체요건","논문대체"],"rule_ids":["cwnu.cs.2026.graduation.thesis-substitution"]},
    {"intent_id":"major.counseling-completion","kind":"specific","aliases":["심층상담0학점","심층상담이수","심층상담횟수","심층상담"],"rule_ids":["cwnu.cs.2026.major-counseling-completion"]},
    {"intent_id":"major.required-course-set","kind":"specific","aliases":["전공필수9과목","전공필수과목목록","전필9과목","전공필수과목","전필과목","필수전공과목"],"rule_ids":["cwnu.cs.2026.major-required-course-set"]},
    {"intent_id":"operations.pccp-current-trial","kind":"specific","aliases":["현행pccp합격기준","pccp합격기준","pccp합격점수"],"rule_ids":["cwnu.cs.2026.operations.pccp-current-trial"]},
    {"intent_id":"operations.coding-test-failure","kind":"specific","aliases":["코딩테스트미통과시처리","코테미통과시처리","코딩테스트미통과조치"],"rule_ids":["cwnu.cs.2026.operations.coding-test-failure"]},
    {"intent_id":"operations.graduation-work-prerequisite","kind":"specific","aliases":["졸업작품수강선행조건","졸업작품수강선수요건","졸업작품수강전제조건"],"rule_ids":["cwnu.cs.2026.operations.graduation-work-prerequisite"]},
    {"intent_id":"credits.general.bundle","kind":"bundle","aliases":["교양학점","교양은","교양"],"rule_ids":["cwnu.cs.2026.credits.general-balanced","cwnu.cs.2026.credits.general-foundation","cwnu.cs.2026.credits.general-remaining","cwnu.cs.2026.credits.general-total"]},
    {"intent_id":"credits.major.bundle","kind":"bundle","aliases":["전공학점","전공은","전공"],"rule_ids":["cwnu.cs.2026.credits.major-advanced","cwnu.cs.2026.credits.major-elective","cwnu.cs.2026.credits.major-minimum","cwnu.cs.2026.credits.major-required","cwnu.cs.2026.credits.major-total"]}
  ]
}
